<?xml version="1.0" encoding="UTF-8"?>

<!--Sample XML file generated by XMLSpy v2006 rel. 3 sp2 (http://www.altova.com)-->

<StandardSettings xmlns:xsi="http://www.w3.org/2001/XMLSchema-instance" xsi:noNamespaceSchemaLocation="..\StandardSettingsV4.xsd">

	<AlgorithmParameters>

		<CurveFitParameters>

			<NoiseThreshold>300</NoiseThreshold>

			<WindowWidth>9</WindowWidth>

			<MinFitForNormalPeak>0.98</MinFitForNormalPeak>

			<TriggerFitForArtifact>0.99</TriggerFitForArtifact>

			<AbsoluteMinimumFit>0.85</AbsoluteMinimumFit>

			<TestForNegSecondaryContent>false</TestForNegSecondaryContent>

			<ParametricFitTolerance>0.999995</ParametricFitTolerance>

			<NumberOfIntegrationSteps>50</NumberOfIntegrationSteps>

			<SigmaTolerance>0.00015</SigmaTolerance>

			<SigmaWidth>10.0</SigmaWidth>

			<MaximumIterations>5</MaximumIterations>

			<SigmaRatio>4.5</SigmaRatio>

			<InterSampleSpacing>1</InterSampleSpacing>

			<SignatureSigma>2.0</SignatureSigma>

			<BlobDegree>6</BlobDegree>

			<MinDistanceBetweenPeaks>1.5</MinDistanceBetweenPeaks>

			<PeakFractionForEndPtTest>0.25</PeakFractionForEndPtTest>

			<PeakLevelForEndPtTest>60.0</PeakLevelForEndPtTest>

			<LowTailHeightThreshold>0.1</LowTailHeightThreshold>

			<LowTailSlopeThreshold>0.1</LowTailSlopeThreshold>

			<MinSamplesForSlopeRegression>4</MinSamplesForSlopeRegression>

		</CurveFitParameters>

		<LaneStandardSearch>

			<AcceptanceFactorOfMaxPeak>0.34</AcceptanceFactorOfMaxPeak>

			<EndTestFactor>0.335</EndTestFactor>

			<SkipFractionOfInitialPeaks>0.4</SkipFractionOfInitialPeaks>

			<MinCorrelationForRecursiveSearch>0.98</MinCorrelationForRecursiveSearch>

			<MaxStartPtsForPartialSearch>6</MaxStartPtsForPartialSearch>

			<BeginAnalysisProportion>0.75</BeginAnalysisProportion>

			<LaneStandardSearchSpacing>

				<MaxSpacingMultiple>1.5</MaxSpacingMultiple>

				<MinSpacingMultiple>0.6</MinSpacingMultiple>

			</LaneStandardSearchSpacing>

			<CorrelationThresholds>

				<ILSSpecificThreshold>

					<Synonym>iPLEXSTRLIZ500less250</Synonym>

					<CorrelationWiithIdeal>0.995</CorrelationWiithIdeal>

				</ILSSpecificThreshold>

			</CorrelationThresholds>

		</LaneStandardSearch>

		<LadderLocusSearch>

			<LadderLociMinimumCorrelationWithIdeal>0.999</LadderLociMinimumCorrelationWithIdeal>

			<LadderLocusSearchSpacing>

				<MaxSpacingMultiple>1.2</MaxSpacingMultiple>

				<MinSpacingMultiple>0.7</MinSpacingMultiple>

			</LadderLocusSearchSpacing>

			<MaxStartPtsForPartialSearch>6</MaxStartPtsForPartialSearch>

		</LadderLocusSearch>

	</AlgorithmParameters>

	<StandardParameters>

		<MsgDoubleResolution>10</MsgDoubleResolution>

		<MinSigmaForDyeBlob>6.0</MinSigmaForDyeBlob>

		<SecondaryContentLimitFraction>0.9</SecondaryContentLimitFraction>

		<MinFractionExpectedPeakWidth>0.6</MinFractionExpectedPeakWidth>

		<MaxMultipleExpectedPeakWidth>1.6</MaxMultipleExpectedPeakWidth>

		<WidthMatchFraction>0.1</WidthMatchFraction>

		<MaxSpikeWidth>1.0</MaxSpikeWidth>

		<CraterSigmaMultiple>2.0</CraterSigmaMultiple>

	</StandardParameters>

	<StdMarkerSetSpecifications>

		<StdMarkerSetCollection>

			<MarkerSetName>iPLEXSTRLIZ500less250</MarkerSetName>

			<PositiveControls>

				<PositiveControl>

					<Name>Positive</Name>

					<Loci>

						<Locus>

							<Name>AMEL</Name>

							<Allele>

								<Name>1</Name>

								<BioID>81</BioID>

							</Allele>

							<Allele>
  
								<Name>2</Name>

								<BioID>84</BioID>

							</Allele>

						</Locus>

						<Locus>

							<Name>D3S1358</Name>

							<Allele>

								<Name>15</Name>

								<BioID>124</BioID>

							</Allele>
  
							<Allele>

								<Name>17</Name>

								<BioID>132</BioID>
  
              </Allele>

            </Locus>

						<Locus>

							<Name>TH01</Name>

							<Allele>

								<Name>6</Name>

								<BioID>163</BioID>

							</Allele>

							<Allele>

								<Name>9.3</Name>

								<BioID>178</BioID>

							</Allele>

						</Locus>

						<Locus>

							<Name>D12S391</Name>

							<Allele>

								<Name>21</Name>

								<BioID>239</BioID>

							</Allele>

							<Allele>

								<Name>23</Name>

								<BioID>247</BioID>

							</Allele>

						</Locus>

						<Locus>

							<Name>D1S1656</Name>

							<Allele>

								<Name>11</Name>

								<BioID>290</BioID>

							</Allele>

						</Locus>

						<Locus>

							<Name>D10S1248</Name>

							<Allele>

								<Name>13</Name>

								<BioID>368</BioID>

							</Allele>

							<Allele>

								<Name>15</Name>

								<BioID>376</BioID>

							</Allele>

						</Locus>

						<Locus>

							<Name>D2S441</Name>

							<Allele>

								<Name>9</Name>

								<BioID>91</BioID>

							</Allele>

							<Allele>

								<Name>13</Name>

								<BioID>107</BioID>

							</Allele>

						</Locus>

						<Locus>

							<Name>D7S820</Name>

							<Allele>

								<Name>10</Name>

								<BioID>157</BioID>

							</Allele>

							<Allele>

								<Name>12</Name>

								<BioID>165</BioID>

							</Allele>

						</Locus>

						<Locus>

							<Name>D13S317</Name>

							<Allele>

								<Name>11</Name>

								<BioID>208</BioID>

							</Allele>

							<Allele>

								<Name>12</Name>

								<BioID>212</BioID>

							</Allele>

						</Locus>

						<Locus>

							<Name>FGA</Name>

							<Allele>

								<Name>20</Name>

								<BioID>267</BioID>

							</Allele>

							<Allele>

								<Name>26</Name>

								<BioID>291</BioID>

							</Allele>

						</Locus>

						<Locus>

							<Name>TPOX</Name>

							<Allele>

								<Name>8</Name>

								<BioID>87</BioID>

							</Allele>

						</Locus>

						<Locus>

							<Name>D18S51</Name>

							<Allele>

								<Name>12</Name>

								<BioID>149</BioID>

							</Allele>

							<Allele>

								<Name>14</Name>

								<BioID>157</BioID>

							</Allele>

						</Locus>

						<Locus>

							<Name>D16S539</Name>

							<Allele>

								<Name>9</Name>

								<BioID>230</BioID>

							</Allele>
  
							<Allele>

								<Name>11</Name>

								<BioID>238</BioID>

							</Allele>

						</Locus>

						<Locus>

							<Name>D8S1179</Name>

							<Allele>

								<Name>9</Name>

								<BioID>276</BioID>

							</Allele>
  
						<Allele>

								<Name>10</Name>

								<BioID>280</BioID>

							</Allele>

						</Locus>

						<Locus>

							<Name>CSF1PO</Name>

							<Allele>

								<Name>9</Name>

								<BioID>338</BioID>

							</Allele>

							<Allele>

								<Name>11</Name>

								<BioID>346</BioID>

							</Allele>

						</Locus>
  
						<Locus>

							<Name>D5S818</Name>

							<Allele>

								<Name>10</Name>

								<BioID>392</BioID>

							</Allele>

							<Allele>

								<Name>11</Name>

								<BioID>396</BioID>

							</Allele>

						</Locus>
  
						<Locus>

							<Name>vWA</Name>

							<Allele>

								<Name>15</Name>

								<BioID>124</BioID>

							</Allele>

							<Allele>

								<Name>18</Name>

								<BioID>136</BioID>

							</Allele>

						</Locus>
  
						<Locus>

							<Name>D21S11</Name>

							<Allele>

								<Name>27</Name>

								<BioID>179</BioID>

							</Allele>

							<Allele>

								<Name>28</Name>

								<BioID>183</BioID>

							</Allele>

						</Locus>
  
            <Locus>

							<Name>SE33O</Name>

							<Allele>

								<Name>17</Name>

								<BioID>302</BioID>

							</Allele>

							<Allele>

								<Name>21.2</Name>

								<BioID>320</BioID>

							</Allele>
  
							</Locus>
  
					</Loci>

				</PositiveControl>

			</PositiveControls>

		</StdMarkerSetCollection>

	</StdMarkerSetSpecifications>

</StandardSettings>

